{
  "agent_id": "agent://coordination.gateway",
  "title": "Coordination Gateway",
  "description": "Routes bounded MACP sessions across the standard coordination modes.",
  "supported_modes": [
    "macp.mode.decision.v1",
    "macp.mode.proposal.v1",
    "macp.mode.task.v1",
    "macp.mode.handoff.v1",
    "macp.mode.quorum.v1"
  ],
  "input_content_types": [
    "application/macp-envelope+proto",
    "application/macp-envelope+json"
  ],
  "output_content_types": [
    "application/macp-envelope+proto",
    "application/macp-envelope+json"
  ],
  "transport_endpoints": [
    {
      "transport": "macp.transport.grpc.v1",
      "uri": "grpcs://checkout.example.com:50051",
      "content_types": [
        "application/macp-envelope+proto"
      ],
      "metadata": {
        "audience": "internal"
      }
    },
    {
      "transport": "macp.transport.http.v1",
      "uri": "https://checkout.example.com/api",
      "content_types": [
        "application/json"
      ]
    }
  ],
  "metadata": {
    "owner": "payments-platform",
    "tier": "prod"
  }
}
